页面标题,URL,浏览次数,最后编辑时间
"STLPak Food Packaging supplier in China, OEM&ODM",https://stlpak.com/,228,2024-06-14 11:19 +00:00
STLPak Catalog Book - STLPak,https://stlpak.com/15158-2/,29,
"ShiTuLi Blueberry Container Manufacturer in China, OEM",https://stlpak.com/plastic-punnets/blueberry-punnet/,21,
Contact ShiTuLi Plastic Food Packaging Team Now,https://stlpak.com/contact-for-a-quote/,20,2024-12-05 02:39 +00:00
"ShiTuLi Fruit Packaging Plastic Box Supplier in China, OEM&ODM",https://stlpak.com/plastic-punnets/plastic-fruit-container/,18,
"ShiTuLi Plastic Fruit Container Manufacture in China, OEM&ODM",https://stlpak.com/plastic-punnets/,13,2023-09-08 08:02 +00:00
ShiTuLi Disposable Plastic Fruit Tray Supplier in China,https://stlpak.com/cpet-hot-food-tray/,12,
ShiTuLi Plastic Egg Tray Supplier in China,https://stlpak.com/egg-tray/clear-egg-carton/,12,
Focus on Plastic Food Packing in China,https://stlpak.com/about-us/,11,2023-09-25 03:06 +00:00
ShiTuLi Baking Containers Manufacture in China,https://stlpak.com/plastic-punnets/plastic-baking-containers/,11,
SHITULI Food Packaging has Leading Equipment in China,https://stlpak.com/about-us/stlpak-team/,9,
"ShiTuLi FOOD PACK Vendors, OEM&ODM",https://stlpak.com/blog/,9,2024-01-16 06:49 +00:00
250G PET Plastic Packaging Fruit Container - STLPak,https://stlpak.com/plastic-punnets/plastic-fruit-container/250ml-pet-plastic-packaging-fruit-box/,8,
ShiTuLi Egg Tray Manufacture in China,https://stlpak.com/egg-tray/,7,
"ShiTuLi Kraft Bowl Manufacture in China, OEM&ODM",https://stlpak.com/paper-food-container/kraft-bowl/,7,
ShiTuLi Professional Plastic Food Tray Vendors in China,https://stlpak.com/plastic-food-tray/,7,
"ShiTuLi Plastic Vegetable Tray Supplier in China, OEM&ODM",https://stlpak.com/plastic-food-tray/plastic-vegetable-packaging/,7,
"Tamper Evident Container Manufacture In China, OEM&ODM",https://stlpak.com/plastic-punnets/tamper-evident-container/,7,
Page not found - STLPak,https://stlpak.com/404.html?page=/(redacted)&from=,6,
ShiTuLi Egg Tray Manufacture in China,https://stlpak.com/bagasse-food-container/,6,
"ShiTuLi Salad Cup factory in China, OEM&ODM",https://stlpak.com/disposable-cup/plastic-cup/,6,
"ShiTuLi Takeaway Container Manufacture in China, OEM&ODM",https://stlpak.com/takeaway-container/,6,
SHITULI Food Packaging has Leading Equipment in China,https://stlpak.com/about-us/equipment/,5,
ShiTuLi Disposable Cup Supplier in China,https://stlpak.com/disposable-cup/,5,
"ShiTuLi Plastic Salad Containers Supplier in China, OEM&ODM",https://stlpak.com/plastic-punnets/plastic-salad-containers-2/,5,
ShiTuLi Food Container With Compartments Manufacture in China,https://stlpak.com/takeaway-container/food-container-with-compartments/,5,
"ShiTuLi Kraft Bowl Manufacture in China, OEM&ODM",https://stlpak.com/plastic-meat-packaging-trays/,4,
ShiTuLi Clamshell Grapes Plastic Packaging Supplier in China,https://stlpak.com/plastic-punnets/clamshell-grapes/,4,
"ShiTuLi Plastic Apple Containers Supplier in China, OEM&ODM",https://stlpak.com/plastic-punnets/plastic-apple-containers/,4,
"ShiTuLi Food Packaging Supplier in China, OEM&ODM",https://stlpak.com/thank-you/,4,2023-03-27 10:06 +00:00
Ultimate Guide to Biodegradable Packaging-Cornstarch Packaging,https://stlpak.com/an-ultimate-guide-to-biodegradable-packaging-cornstarch-packaging/,3,
"ShiTuLi Salad Cup factory in China, OEM&ODM",https://stlpak.com/disposable-cup/clear-bucket-with-lid/,3,
ShiTuLi Square Plastic Containers Manufacture in China,https://stlpak.com/paper-food-container/,3,2024-04-22 05:39 +00:00
ShiTuLi Disposable Plastic Fruit Tray Supplier in China,https://stlpak.com/plastic-food-tray/disposable-plastic-fruit-tray/,3,
ShiTuLi Roast Chicken Box Manufacture in China,https://stlpak.com/plastic-punnets/chicken-packaging-box/,3,
"ShiTuLi Fruit Cut Container Manufacturer in China, OEM&ODM",https://stlpak.com/plastic-punnets/cut-fruit-container/,3,
"ShiTuLi Round Plastic Containers Supplier in China, OEM&ODM",https://stlpak.com/takeaway-container/round-plastic-containers/,3,
An Ultimate Guide to Clamshell Packaging,https://stlpak.com/clamshell-packaging-the-ultimate-guide/,2,2023-12-28 06:04 +00:00
"STLPak Strawberry Box Factory in China, OEM&ODM",https://stlpak.com/plastic-punnets/strawberry-punnet/,2,
SHITULI Food Packaging Manufacture in China,https://stlpak.com/about-us/certification/,1,
ShiTuLi Professional Dessert Cups Manufacture in China,https://stlpak.com/bagasse-food-container/bagasse-bento-box/,1,
"ShiTuLi Salad Cup factory in China, OEM&ODM",https://stlpak.com/disposable-cup/paper-cup/,1,
ShiTuLi Professional Egg Carton Manufacture in China,https://stlpak.com/egg-tray/egg-carton/,1,
"ShiTuLi Kraft Bowl Manufacture in China, OEM&ODM",https://stlpak.com/paper-food-container/kraft-boat-tray/,1,
ShiTuLi Professional Paper food trays Manufacture in China,https://stlpak.com/paper-food-container/paper-food-trays/,1,
125B1 Transparent PET Blueberry Punnet Eco-friendly Packaging - STLPak,https://stlpak.com/plastic-punnets/blueberry-punnet/125b1-transparent-pet-blueberry-punnet-eco-friendly-packaging/,1,
ShiTuLi Professional Dessert Cups Manufacture in China,https://stlpak.com/bagasse-food-container/bagasse-sushi-tray/,0,
125B2 Clear Plastic Blueberry Punnet Strong Buckle Design - STLPak,https://stlpak.com/plastic-punnets/blueberry-punnet/125b2-clear-plastic-blueberry-punnet-strong-buckle-design/,0,
125C1 Transparent PET Blueberry Punnet Plastic Packaging - STLPak,https://stlpak.com/plastic-punnets/blueberry-punnet/125c1-transparent-pet-blueberry-container-plastic-packaging/,0,
"ShiTuLi Kiwi Plastic Packaging Manufacture in China, OEM&ODM",https://stlpak.com/plastic-punnets/kiwi-plastic-packaging/,0,
